{
	"type": "array",
	"$schema": "http://json-schema.org/draft-04/schema#",
	"description": "",
	"minItems": 1,
	"uniqueItems": true,
	"items": {
		"type": "object",
		"required": [
			"_id",
			"name",
			"modversion",
			"gameversion",
			"loaderversion",
			"modtype",
			"author",
			"description",
			"searchtags",
			"requirements",
			"downloadlink",
			"sourcelink",
			"changelog",
			"embedcolor"
		],
		"properties": {
			"_id": {
				"type": "number"
			},
			"name": {
				"type": "string",
				"minLength": 1
			},
			"modversion": {
				"type": "string",
				"minLength": 1
			},
			"gameversion": {
				"type": "string",
				"minLength": 1
			},
			"loaderversion": {
				"type": "string",
				"minLength": 1
			},
			"modtype": {
				"type": "string",
				"minLength": 1
			},
			"author": {
				"type": "string",
				"minLength": 1
			},
			"description": {
				"type": "string",
				"minLength": 1
			},
			"searchtags": {
				"type": "array",
				"items": {
					"required": [],
					"properties": {}
				}
			},
			"requirements": {
				"type": "array",
				"items": {
					"required": [],
					"properties": {}
				}
			},
			"downloadlink": {
				"type": "string",
				"minLength": 1
			},
			"sourcelink": {
				"type": "string",
				"minLength": 1
			},
			"changelog": {
				"type": "string",
				"minLength": 1
			},
			"embedcolor": {
				"type": "string",
				"minLength": 1
			}
		}
	}
}
