{
  "_id": -1,
  "name": "RetroCVR",
  "modversion": "0.0.1",
  "gameversion": "2023r173",
  "loaderversion": "v0.6.1",
  "modtype": "Mod",
  "author": "kafeijao",
  "description": "Adds LibRetro to CVR.\n\nCheck [README.md](https://github.com/kafeijao/Kafe_CVR_Mods/tree/master/RetroCVR) for more in-depth info.\n\n",
  "searchtags": [
    "retro",
    "lib",
    "libretro",
    "emulator",
    "emulation"
  ],
  "requirements": ["[BTKUILib](https://api.cvrmg.com/v1/mods/download/113)"],
  "downloadlink": "https://github.com/kafeijao/Kafe_CVR_Mods/releases/download/r62/RetroCVR.dll",
  "sourcelink": "https://github.com/kafeijao/Kafe_CVR_Mods/tree/master/RetroCVR",
  "changelog": "- Initial Release.",
  "embedcolor": "16C60C"
}
