{
  "_id": 194,
  "name": "NavMeshFollower",
  "modversion": "0.0.6",
  "gameversion": "2024r175",
  "loaderversion": "v0.6.1",
  "modtype": "Mod",
  "author": "kafeijao",
  "description": "Simple mod that allows to control a prop nav mesh agent.\n\nCheck [README.md](https://github.com/kafeijao/Kafe_CVR_Mods/tree/master/NavMeshFollower) for more in-depth info.\n\n",
  "searchtags": [
    "nav",
    "mesh",
    "agent",
    "ai",
    "prop"
  ],
  "requirements": ["[NavMeshTools](https://api.cvrmg.com/v1/mods/download/193)", "[RequestLib](https://api.cvrmg.com/v1/mods/download/169)", "[BTKUILib](https://api.cvrmg.com/v1/mods/download/113)"],
  "downloadlink": "https://github.com/kafeijao/Kafe_CVR_Mods/releases/download/r67/NavMeshFollower.dll",
  "sourcelink": "https://github.com/kafeijao/Kafe_CVR_Mods/tree/master/NavMeshFollower",
  "changelog": "- Fixed for 2024r175\n- Prevent followers from making you seat when they're holding a prop with a seat",
  "embedcolor": "16C60C"
}
