{
  "_id": 177,
  "name": "BetterCache",
  "modversion": "0.0.3",
  "gameversion": "2023r172",
  "loaderversion": "v0.6.1",
  "modtype": "Mod",
  "author": "kafeijao",
  "description": "Simple mod that improves the Cache management and cleaning.\n\n**__Features__**\n- Deletes the files with older accessed date when above the limit\n- Set a custom Cache Folder location (default: `ChilloutVR/Cache/`)\n- Set a Max limit for the Cache (default: `20GB`)\n- Buttons to clear cache\n- Deletes original Cache Folders to prevent cluttering\n\nCheck [README.md](https://github.com/kafeijao/Kafe_CVR_Mods/tree/master/BetterCache) for more in-depth info.\n\n",
  "searchtags": [
    "better",
    "cache"
  ],
  "requirements": ["[BTKUILib](https://api.cvrmg.com/v1/mods/download/113)"],
  "downloadlink": "https://github.com/kafeijao/Kafe_CVR_Mods/releases/download/r60/BetterCache.dll",
  "sourcelink": "https://github.com/kafeijao/Kafe_CVR_Mods/tree/master/BetterCache",
  "changelog": "- Stop poking cohtml outside of main thread.",
  "embedcolor": "16C60C"
}
